"Code","Description","Condition","Sub-condition"
"I63.0","Cerebral infarction due to thrombosis of precerebral arteries","Stroke","Ischaemic stroke"
"I63.1","Cerebral infarction due to embolism of precerebral arteries","Stroke","Ischaemic stroke"
"I63.2","Cerebral infarction due to unspecified occlusion or stenosis of precerebral arteries","Stroke","Ischaemic stroke"
"I63.3","Cerebral infarction due to thrombosis of cerebral arteries","Stroke","Ischaemic stroke"
"I63.4","Cerebral infarction due to embolism of cerebral arteries","Stroke","Ischaemic stroke"
"I63.5","Cerebral infarction due to unspecified occlusion or stenosis of cerebral arteries","Stroke","Ischaemic stroke"
"I63.8","Other cerebral infarction","Stroke","Ischaemic stroke"
"I63.9","Cerebral infarction, unspecified","Stroke","Ischaemic stroke"
"I69.3","Sequelae of cerebral infarction","Stroke","Ischaemic stroke"
