"Code","Description","Condition","Sub-condition"
"G130.","Mitral and aortic stenosis","Heart valve disorders","Multiple valve dz"
"G131.","Mitral stenosis and aortic insufficiency","Heart valve disorders","Multiple valve dz"
"G132.","Mitral insufficiency and aortic stenosis","Heart valve disorders","Multiple valve dz"
"G133.","Mitral and aortic incompetence","Heart valve disorders","Multiple valve dz"
"G13..","Diseases of mitral and aortic valves","Heart valve disorders","Multiple valve dz"
"G13z.","Mitral and aortic valve disease NOS","Heart valve disorders","Multiple valve dz"
"G5441","Disorders of both mitral and tricuspid valves","Heart valve disorders","Multiple valve dz"
"G544.","Multiple valve diseases","Heart valve disorders","Multiple valve dz"
