"Code","Description","Condition","Sub-condition"
"B110.","Malignant neoplasm of cardia of stomach","Solid organ malignancies","Primary Malignancy_Stomach"
"B1110","Malignant neoplasm of prepylorus of stomach","Solid organ malignancies","Primary Malignancy_Stomach"
"B111.","Malignant neoplasm of pylorus of stomach","Solid organ malignancies","Primary Malignancy_Stomach"
"B114.","Malignant neoplasm of body of stomach","Solid organ malignancies","Primary Malignancy_Stomach"
"B118.","Siewert type II adenocarcinoma","Solid organ malignancies","Primary Malignancy_Stomach"
"B119.","Siewert type III adenocarcinoma","Solid organ malignancies","Primary Malignancy_Stomach"
"B11..","Malignant neoplasm of stomach","Solid organ malignancies","Primary Malignancy_Stomach"
"B11z.","Malignant neoplasm of stomach NOS","Solid organ malignancies","Primary Malignancy_Stomach"
"ZV100","[V]Personal history of malignant neoplasm of gastrointestinal tract","Solid organ malignancies","Primary Malignancy_Stomach"
